{
  "$schema": "https://json-schema.org/draft/2020-12/schema",
  "$id": "urn:aeterna:protocol:v1:recovery-secret-request",
  "additionalProperties": false,
  "properties": {
    "claim_token": { "$ref": "common.schema.json#/$defs/base64url32" },
    "device_id": { "$ref": "common.schema.json#/$defs/uuid" },
    "protocol_version": { "$ref": "common.schema.json#/$defs/protocolVersion" },
    "recovery_id": { "$ref": "common.schema.json#/$defs/uuid" },
    "request_id": { "$ref": "common.schema.json#/$defs/uuid" },
    "vault_id": { "$ref": "common.schema.json#/$defs/uuid" },
    "wrapper_digest": { "$ref": "common.schema.json#/$defs/base64url32" }
  },
  "required": [
    "claim_token",
    "device_id",
    "protocol_version",
    "recovery_id",
    "request_id",
    "vault_id",
    "wrapper_digest"
  ],
  "type": "object"
}
