{
  "protocol_version": 1,
  "request_id": "00000000-0000-4000-8000-000000000047",
  "claim_token": "iIiIiIiIiIiIiIiIiIiIiIiIiIiIiIiIiIiIiIiIiIg",
  "device_id": "00000000-0000-4000-8000-000000000003",
  "recovery_id": "00000000-0000-4000-8000-000000000041",
  "vault_id": "00000000-0000-4000-8000-000000000042",
  "wrapper_digest": "ZmZmZmZmZmZmZmZmZmZmZmZmZmZmZmZmZmZmZmZmZmY"
}
